{
  "session_id": "sess-2026-04-08-120000",
  "date": "2026-04-08",
  "platform": "claude_code",
  "spec_id": null,
  "workflow_phase": "other",
  "duration_minutes": 30,
  "outcome": "success",
  "iterations": 0,
  "human_interventions": 0,
  "issues": [],
  "rules_violated": [],
  "agent_strengths": [
    "Feedback pipeline infrastructure created correctly"
  ],
  "notes": "Setup session: added feedback pipeline, fixed CI branch trigger, created context files. This is a seed log to validate the aggregation script."
}
